{
  "$schema": "https://json-schema.org/draft/2020-12/schema",
  "$id": "https://twin2multicloud.local/contracts/five-layer-workload/v2/eventing-scenario-catalog.schema.json",
  "title": "Eventing Scenario Catalog v1",
  "type": "object",
  "additionalProperties": false,
  "required": [
    "schema_version",
    "package_id",
    "decision_ref",
    "decision_byte_digest",
    "scenario_source_ref",
    "scenario_source_byte_digest",
    "scenario_source_content_digest",
    "scenarios",
    "scenario_digests",
    "content_digest"
  ],
  "properties": {
    "schema_version": {
      "const": "eventing-scenario-catalog.v1"
    },
    "package_id": {
      "const": "phase-08-eventing-implementation@1"
    },
    "decision_ref": {
      "const": "docs/research/evidence/phase_08_eventing/decision.json"
    },
    "decision_byte_digest": {
      "$ref": "#/$defs/digest"
    },
    "scenario_source_ref": {
      "const": "docs/research/evidence/phase_08_eventing/scenario-inputs.json"
    },
    "scenario_source_byte_digest": {
      "$ref": "#/$defs/digest"
    },
    "scenario_source_content_digest": {
      "$ref": "#/$defs/digest"
    },
    "scenarios": {
      "type": "array",
      "minItems": 3,
      "maxItems": 3,
      "items": {
        "type": "object",
        "additionalProperties": false,
        "required": [
          "scenario_id",
          "events_per_month",
          "publish_requests_per_month",
          "average_event_payload_bytes",
          "mandatory_processed_consumers",
          "extra_processed_consumers",
          "retry_share",
          "dead_letter_share",
          "replay_share",
          "retention_hours",
          "ordering_scope",
          "required_delivery_semantics",
          "max_delivery_latency_seconds",
          "peak_events_per_second",
          "active_partition_keys",
          "concurrent_device_connections",
          "rule_match_share",
          "workflow_start_share_of_matches",
          "device_command_share_of_matches",
          "bounded_synthetic_scenario"
        ],
        "properties": {
          "scenario_id": {
            "enum": [
              "eventing-small-v1",
              "eventing-medium-v1",
              "eventing-large-v1"
            ]
          },
          "events_per_month": {
            "type": "integer",
            "minimum": 1
          },
          "publish_requests_per_month": {
            "type": "integer",
            "minimum": 1
          },
          "average_event_payload_bytes": {
            "type": "integer",
            "minimum": 1
          },
          "mandatory_processed_consumers": {
            "type": "array",
            "minItems": 3,
            "uniqueItems": true,
            "items": {
              "type": "string",
              "minLength": 1
            }
          },
          "extra_processed_consumers": {
            "type": "array",
            "uniqueItems": true,
            "items": {
              "type": "string",
              "minLength": 1
            }
          },
          "retry_share": {
            "type": "number",
            "minimum": 0,
            "maximum": 1
          },
          "dead_letter_share": {
            "type": "number",
            "minimum": 0,
            "maximum": 1
          },
          "replay_share": {
            "type": "number",
            "minimum": 0,
            "maximum": 1
          },
          "retention_hours": {
            "type": "integer",
            "minimum": 1
          },
          "ordering_scope": {
            "const": "per_device"
          },
          "required_delivery_semantics": {
            "const": "at_least_once"
          },
          "max_delivery_latency_seconds": {
            "type": "number",
            "exclusiveMinimum": 0
          },
          "peak_events_per_second": {
            "type": "number",
            "exclusiveMinimum": 0
          },
          "active_partition_keys": {
            "type": "integer",
            "minimum": 1
          },
          "concurrent_device_connections": {
            "type": "integer",
            "minimum": 1
          },
          "rule_match_share": {
            "type": "number",
            "minimum": 0,
            "maximum": 1
          },
          "workflow_start_share_of_matches": {
            "type": "number",
            "minimum": 0,
            "maximum": 1
          },
          "device_command_share_of_matches": {
            "type": "number",
            "minimum": 0,
            "maximum": 1
          },
          "bounded_synthetic_scenario": {
            "const": true
          }
        }
      }
    },
    "scenario_digests": {
      "type": "object",
      "additionalProperties": false,
      "required": [
        "eventing-small-v1",
        "eventing-medium-v1",
        "eventing-large-v1"
      ],
      "properties": {
        "eventing-small-v1": {
          "$ref": "#/$defs/digest"
        },
        "eventing-medium-v1": {
          "$ref": "#/$defs/digest"
        },
        "eventing-large-v1": {
          "$ref": "#/$defs/digest"
        }
      }
    },
    "content_digest": {
      "$ref": "#/$defs/digest"
    }
  },
  "$defs": {
    "digest": {
      "type": "string",
      "pattern": "^sha256:[0-9a-f]{64}$"
    }
  }
}
