{
  "schema_version": "eventing-scenario-catalog.v1",
  "package_id": "phase-08-eventing-implementation@1",
  "decision_ref": "docs/research/evidence/phase_08_eventing/decision.json",
  "decision_byte_digest": "sha256:d6913db74bbcdaa758e7a05f16f2755760247521ad1b2067d99dccee5c8a637f",
  "scenario_source_ref": "docs/research/evidence/phase_08_eventing/scenario-inputs.json",
  "scenario_source_byte_digest": "sha256:a49ce526ff03881b944a217913de4b4e10a28d8c27989f0ad9445043a2574506",
  "scenario_source_content_digest": "sha256:1391c4463df31027e6f08bc67c538669a7b18777a9e42136af9d3f79db1f327b",
  "scenarios": [
    {
      "scenario_id": "eventing-small-v1",
      "events_per_month": 100000,
      "publish_requests_per_month": 100000,
      "average_event_payload_bytes": 4096,
      "mandatory_processed_consumers": [
        "consumer.historical-persistence",
        "consumer.twin-state-update",
        "consumer.rule-evaluator"
      ],
      "extra_processed_consumers": [],
      "retry_share": 0.001,
      "dead_letter_share": 0.0001,
      "replay_share": 0,
      "retention_hours": 24,
      "ordering_scope": "per_device",
      "required_delivery_semantics": "at_least_once",
      "max_delivery_latency_seconds": 30,
      "peak_events_per_second": 10,
      "active_partition_keys": 100,
      "concurrent_device_connections": 100,
      "rule_match_share": 0.01,
      "workflow_start_share_of_matches": 0.25,
      "device_command_share_of_matches": 0.25,
      "bounded_synthetic_scenario": true
    },
    {
      "scenario_id": "eventing-medium-v1",
      "events_per_month": 10000000,
      "publish_requests_per_month": 10000000,
      "average_event_payload_bytes": 16384,
      "mandatory_processed_consumers": [
        "consumer.historical-persistence",
        "consumer.twin-state-update",
        "consumer.rule-evaluator"
      ],
      "extra_processed_consumers": [],
      "retry_share": 0.005,
      "dead_letter_share": 0.0005,
      "replay_share": 0.01,
      "retention_hours": 168,
      "ordering_scope": "per_device",
      "required_delivery_semantics": "at_least_once",
      "max_delivery_latency_seconds": 10,
      "peak_events_per_second": 250,
      "active_partition_keys": 10000,
      "concurrent_device_connections": 10000,
      "rule_match_share": 0.01,
      "workflow_start_share_of_matches": 0.25,
      "device_command_share_of_matches": 0.25,
      "bounded_synthetic_scenario": true
    },
    {
      "scenario_id": "eventing-large-v1",
      "events_per_month": 100000000,
      "publish_requests_per_month": 100000000,
      "average_event_payload_bytes": 65536,
      "mandatory_processed_consumers": [
        "consumer.historical-persistence",
        "consumer.twin-state-update",
        "consumer.rule-evaluator"
      ],
      "extra_processed_consumers": [
        "consumer.audit",
        "consumer.realtime-visualization"
      ],
      "retry_share": 0.01,
      "dead_letter_share": 0.001,
      "replay_share": 0.02,
      "retention_hours": 168,
      "ordering_scope": "per_device",
      "required_delivery_semantics": "at_least_once",
      "max_delivery_latency_seconds": 5,
      "peak_events_per_second": 2500,
      "active_partition_keys": 100000,
      "concurrent_device_connections": 100000,
      "rule_match_share": 0.01,
      "workflow_start_share_of_matches": 0.25,
      "device_command_share_of_matches": 0.25,
      "bounded_synthetic_scenario": true
    }
  ],
  "scenario_digests": {
    "eventing-small-v1": "sha256:e960cbb799562c1cc6883e867038575eeb38422859f6bac7a9b4b07f2d497833",
    "eventing-medium-v1": "sha256:5450099e4ee0c0498125bc88a860fa1990acec817d3ce68bb7138e140745acee",
    "eventing-large-v1": "sha256:6fffe6fdf45afc95f5d602dc0128479d3d73ad0af0308e8746a8cdb503691702"
  },
  "content_digest": "sha256:7851b8d44c54a24316a7afc6222764f8e0f9fd7eda3496d334477453fff384c8"
}
